{
  "$schema": "http://json-schema.org/draft-07/schema#",
  "$id": "https://webtoapp.dev/config.schema.json",
  "title": "WebToApp Configuration",
  "description": "Configuration file for the webtoapp conversion pipeline",
  "type": "object",
  "required": ["name", "version", "source", "targets", "mode", "appId", "backend", "auth", "database"],
  "additionalProperties": false,
  "properties": {
    "$schema": {
      "type": "string",
      "description": "JSON Schema reference for VS Code autocomplete"
    },
    "name": {
      "type": "string",
      "minLength": 1,
      "maxLength": 100,
      "description": "Human-readable app name used in installer UI and window title"
    },
    "version": {
      "type": "string",
      "pattern": "^\\d+\\.\\d+\\.\\d+$",
      "description": "Semantic version string (e.g. 1.0.0)",
      "examples": ["1.0.0", "2.1.3"]
    },
    "source": {
      "type": "string",
      "minLength": 1,
      "description": "Absolute/relative path to the source project root, or a live website URL (e.g. https://example.com) to wrap"
    },
    "output": {
      "type": "string",
      "description": "Absolute or relative path for the converted output project. Defaults to <source>-desktop"
    },
    "targets": {
      "type": "array",
      "minItems": 1,
      "uniqueItems": true,
      "items": {
        "type": "string",
        "enum": ["windows", "linux", "mac", "android", "ios"],
        "description": "Target platform to build for"
      },
      "description": "One or more target platforms to build installers for"
    },
    "mode": {
      "type": "string",
      "enum": ["online", "offline", "hybrid"],
      "description": "Conversion mode: online (cloud backend as-is), offline (local SQLite/Express backend), hybrid (local backend + cloud sync)"
    },
    "appId": {
      "type": "string",
      "pattern": "^[a-zA-Z][a-zA-Z0-9]*(\\.[a-zA-Z][a-zA-Z0-9]*)+$",
      "description": "Reverse-domain app identifier (e.g. com.acme.pharmacyapp)",
      "examples": ["com.acme.myapp", "io.example.pharmacy"]
    },
    "icon": {
      "type": "string",
      "description": "Path to a 512x512 PNG icon, relative to source root. Auto-detected if omitted."
    },
    "author": {
      "type": "string",
      "description": "Author name written into package.json (required by electron-builder)",
      "examples": ["Acme Corp", "Jane Doe"]
    },
    "backend": {
      "type": "object",
      "required": ["type"],
      "additionalProperties": false,
      "description": "Backend generation strategy",
      "properties": {
        "type": {
          "type": "string",
          "enum": ["auto", "express", "none"],
          "description": "auto: detect and replace. express: always generate local server. none: static only."
        },
        "port": {
          "type": "integer",
          "minimum": 1024,
          "maximum": 65535,
          "default": 3001,
          "description": "Port for the local Express server"
        }
      }
    },
    "auth": {
      "type": "object",
      "required": ["type"],
      "additionalProperties": false,
      "description": "Auth generation strategy",
      "properties": {
        "type": {
          "type": "string",
          "enum": ["local", "none"],
          "description": "local: generate JWT auth backed by SQLite users table. none: strip auth (single-user)."
        },
        "defaultAdmin": {
          "type": "string",
          "format": "email",
          "description": "Default admin email for the seeded account",
          "examples": ["admin@pharmacy.local"]
        }
      }
    },
    "database": {
      "type": "object",
      "required": ["type"],
      "additionalProperties": false,
      "description": "Database migration strategy",
      "properties": {
        "type": {
          "type": "string",
          "enum": ["sqlite", "none"],
          "description": "sqlite: use better-sqlite3. none: no database generation."
        },
        "migrations": {
          "type": "string",
          "description": "Path to Supabase SQL migrations folder, relative to source root"
        }
      }
    },
    "signing": {
      "type": "object",
      "additionalProperties": false,
      "description": "Code-signing configuration. Credentials can also be supplied via environment variables (safer for CI).",
      "properties": {
        "windows": {
          "type": "object",
          "additionalProperties": false,
          "description": "Windows code-signing settings (NSIS installer). Requires OV or EV certificate.",
          "properties": {
            "certificatePath": {
              "type": "string",
              "description": "Path to a .pfx or .p12 certificate file, relative to source root. Alternatively set WIN_CSC_LINK env var."
            },
            "certificatePassword": {
              "type": "string",
              "description": "Password for the certificate file. Alternatively set WIN_CSC_KEY_PASSWORD env var."
            },
            "publisherName": {
              "type": "string",
              "description": "Publisher name shown in Windows SmartScreen prompt. Must match the CN in your certificate.",
              "examples": ["Acme Corp Ltd", "Jane Doe"]
            },
            "signingHashAlgorithms": {
              "type": "array",
              "items": { "type": "string", "enum": ["sha256"] },
              "default": ["sha256"],
              "description": "Hash algorithms for signing. sha256 is required for modern Windows."
            }
          }
        },
        "mac": {
          "type": "object",
          "additionalProperties": false,
          "description": "macOS code-signing and notarization settings. Requires Apple Developer Program membership.",
          "properties": {
            "certificatePath": {
              "type": "string",
              "description": "Path to a .p12 Developer ID Application certificate. Alternatively set CSC_LINK env var."
            },
            "certificatePassword": {
              "type": "string",
              "description": "Certificate password. Alternatively set CSC_KEY_PASSWORD env var."
            },
            "appleId": {
              "type": "string",
              "format": "email",
              "description": "Apple ID email for notarization. Alternatively set APPLE_ID env var.",
              "examples": ["dev@example.com"]
            },
            "appleIdPassword": {
              "type": "string",
              "description": "App-specific password for the Apple ID. Generate at appleid.apple.com. Alternatively set APPLE_APP_SPECIFIC_PASSWORD env var."
            },
            "teamId": {
              "type": "string",
              "description": "10-character Apple Developer Team ID. Found in developer.apple.com/account. Alternatively set APPLE_TEAM_ID env var.",
              "pattern": "^[A-Z0-9]{10}$",
              "examples": ["ABCD1234EF"]
            }
          }
        }
      }
    },
    "updates": {
      "type": "object",
      "additionalProperties": false,
      "description": "Auto-update delivery configuration. Powered by electron-updater.",
      "properties": {
        "provider": {
          "type": "string",
          "enum": ["github", "generic", "s3", "none"],
          "default": "github",
          "description": "github: use GitHub Releases (zero infra). generic: self-hosted HTTP server. s3: AWS/R2 bucket. none: disable auto-updates."
        },
        "githubOwner": {
          "type": "string",
          "description": "GitHub username or org. Required when provider is 'github'.",
          "examples": ["myorg", "janedoe"]
        },
        "githubRepo": {
          "type": "string",
          "description": "GitHub repository name. Required when provider is 'github'.",
          "examples": ["my-desktop-app"]
        },
        "serverUrl": {
          "type": "string",
          "format": "uri",
          "description": "Base URL of a generic update server. Required when provider is 'generic'.",
          "examples": ["https://updates.example.com/releases"]
        },
        "channel": {
          "type": "string",
          "enum": ["latest", "beta", "alpha"],
          "default": "latest",
          "description": "Update channel. Users on 'latest' only see stable releases."
        },
        "autoDownload": {
          "type": "boolean",
          "default": true,
          "description": "Automatically download updates in the background. If false, the app must call window.electronAPI.downloadUpdate()."
        },
        "allowPrerelease": {
          "type": "boolean",
          "default": false,
          "description": "Include pre-release versions in update checks."
        }
      }
    },
    "crashReporting": {
      "type": "object",
      "additionalProperties": false,
      "description": "Crash reporting configuration. Errors in the Electron main process are automatically captured.",
      "properties": {
        "provider": {
          "type": "string",
          "enum": ["sentry", "none"],
          "default": "none",
          "description": "sentry: use Sentry SDK (cloud or self-hosted Glitchtip). none: disable crash reporting."
        },
        "dsn": {
          "type": "string",
          "format": "uri",
          "description": "Sentry DSN. Can also be set via SENTRY_DSN or VITE_SENTRY_DSN env var.",
          "examples": ["https://examplePublicKey@o0.ingest.sentry.io/0"]
        },
        "sampleRate": {
          "type": "number",
          "minimum": 0,
          "maximum": 1,
          "default": 1,
          "description": "Fraction of errors to send (1.0 = all, 0.5 = 50%). Useful for high-volume apps."
        },
        "environment": {
          "type": "string",
          "default": "production",
          "description": "Environment tag attached to all Sentry events.",
          "examples": ["production", "staging"]
        }
      }
    },
    "ci": {
      "type": "object",
      "additionalProperties": false,
      "description": "CI/CD pipeline configuration for cross-platform cloud builds.",
      "properties": {
        "provider": {
          "type": "string",
          "enum": ["github-actions", "none"],
          "default": "github-actions",
          "description": "CI provider to emit workflow files for."
        },
        "autoEmit": {
          "type": "boolean",
          "default": false,
          "description": "Automatically write .github/workflows/build.yml after a successful local build."
        },
        "githubOwner": {
          "type": "string",
          "description": "GitHub username or org that owns the repository.",
          "examples": ["myorg"]
        },
        "githubRepo": {
          "type": "string",
          "description": "GitHub repository name.",
          "examples": ["my-desktop-app"]
        }
      }
    },
    "devTools": {
      "type": "boolean",
      "default": false,
      "description": "Open Electron DevTools in the output app"
    },
    "titleBar": {
      "type": "string",
      "enum": ["native", "custom"],
      "default": "native",
      "description": "Style of the window title bar. 'native' uses standard OS borders. 'custom' creates a modern borderless app window with custom HTML window controls."
    },
    "verbose": {
      "type": "boolean",
      "default": false,
      "description": "Enable verbose pipeline logging"
    },
    "dryRun": {
      "type": "boolean",
      "default": false,
      "description": "Log every planned action but skip all file writes and npm installs"
    },
    "resumeFromStage": {
      "type": "string",
      "enum": ["01-detect", "02-plan", "03-transform", "04-scaffold", "05-install", "06-build", "06b-parity", "07-package", "07b-mobile", "07c-sign", "08-ci-emit"],
      "description": "Resume the pipeline from this stage, skipping earlier completed stages"
    },
    "cleanLogs": {
      "type": "boolean",
      "default": false,
      "description": "Delete the conversion log file after a successful pipeline run"
    },
    "behaviorParity": {
      "type": "string",
      "enum": ["strict", "warn", "off"],
      "default": "strict",
      "description": "Controls the post-build behavior parity gate. strict blocks packaging when selected-mode behavior cannot be preserved; warn logs findings; off disables the gate."
    },
    "mobile": {
      "type": "object",
      "additionalProperties": false,
      "description": "Mobile-specific build settings. Only used when 'android' or 'ios' appears in targets.",
      "properties": {
        "webDir": {
          "type": "string",
          "minLength": 1,
          "default": "dist",
          "description": "Directory containing built web assets, relative to the converted project"
        },
        "android": {
          "type": "object",
          "additionalProperties": false,
          "description": "Android build overrides",
          "properties": {
            "minSdkVersion": {
              "type": "integer",
              "minimum": 21,
              "default": 22,
              "description": "Minimum Android SDK version (22 = Android 5.1)"
            },
            "targetSdkVersion": {
              "type": "integer",
              "minimum": 21,
              "default": 35,
              "description": "Target Android SDK version. Google Play requires API 35+ for new apps and updates."
            },
            "buildVariant": {
              "type": "string",
              "enum": ["debug", "release"],
              "default": "debug",
              "description": "debug: unsigned APK for testing. release: signed release artifact."
            },
            "artifactType": {
              "type": "string",
              "enum": ["apk", "aab"],
              "default": "aab",
              "description": "Release artifact type. Use aab for Google Play."
            },
            "keystorePath": {
              "type": "string",
              "description": "Path to the release keystore file, relative to source root"
            },
            "keystoreAlias": {
              "type": "string",
              "description": "Keystore alias for release signing"
            },
            "keystorePassword": {
              "type": "string",
              "description": "Keystore password for release signing"
            },
            "keystoreAliasPassword": {
              "type": "string",
              "description": "Key password for release signing. Defaults to keystorePassword if omitted."
            }
          }
        },
        "ios": {
          "type": "object",
          "additionalProperties": false,
          "description": "iOS build overrides (macOS only)",
          "properties": {
            "deploymentTarget": {
              "type": "string",
              "default": "13.0",
              "description": "Minimum iOS deployment target, e.g. '13.0'",
              "examples": ["13.0", "14.0", "15.0"]
            },
            "developmentTeam": {
              "type": "string",
              "description": "Apple developer team ID for Xcode signing. Found in Xcode → Signing & Capabilities.",
              "examples": ["ABCD1234EF"]
            }
          }
        }
      }
    }
  }
}
