{
  "mode": "offline",
  "name": "Pharmacy Tracker",
  "version": "1.0.0",
  "appId": "com.example.pharmacytracker",
  "source": ".",
  "targets": [
    "windows",
    "linux"
  ],
  "backend": {
    "type": "auto",
    "port": 3001
  },
  "auth": {
    "type": "local",
    "defaultAdmin": "admin@app.local"
  },
  "database": {
    "type": "sqlite"
  }
}
